{
  "$schema": "https://raw.githubusercontent.com/Zuriel-Labs/pipeliner/main/schema/pipeliner.schema.json",
  "version": 1,
  "repository": {
    "owner": "Example-Org",
    "name": "example-service",
    "defaultBranch": "main",
    "projectManager": "octocat"
  },
  "project": {
    "owner": "Example-Org",
    "number": 1,
    "title": "Example Service",
    "statusField": "Status",
    "statuses": {
      "backlog": "Backlog",
      "onHold": "On Hold",
      "inProgress": "In Progress",
      "inReview": "In Review",
      "done": "Done"
    },
    "metadataFields": {
      "priority": {
        "name": "Priority",
        "options": [
          "P0",
          "P1",
          "P2",
          "P3"
        ]
      },
      "impact": {
        "name": "Impact",
        "options": [
          "High",
          "Medium",
          "Low"
        ]
      },
      "effort": {
        "name": "Effort",
        "options": [
          "XS",
          "S",
          "M",
          "L",
          "XL"
        ]
      }
    }
  },
  "workflow": {
    "maxActiveIssues": 1,
    "branchPattern": "issue/{number}-{slug}",
    "issueReference": "Refs #{number}",
    "approvalPhrases": {
      "issueCreation": "Approved to create this exact GitHub Issue",
      "production": "Approved to merge and deploy production",
      "completion": "Approved to complete Issue #{number}",
      "nativeCandidate": "Beta approved"
    },
    "pmTesting": {
      "required": true,
      "terms": [
        "Project Manager QA",
        "PM Testing"
      ],
      "requiredSections": [
        "target",
        "prerequisites",
        "numbered actions",
        "expected results",
        "regression checks"
      ]
    }
  },
  "quality": {
    "commands": [
      "npm run check"
    ],
    "requiredChecks": [
      "Quality / verify"
    ]
  },
  "release": {
    "strategy": "immutable-promotion",
    "preReleaseIdentity": ["sourceCommit", "gitTree", "artifactDigest", "deploymentRevision"],
    "candidateIdentity": [
      "sourceCommit",
      "gitTree",
      "artifactDigest",
      "deploymentRevision"
    ],
    "environments": [
      {
        "name": "Canary",
        "role": "review",
        "url": "https://canary.example.invalid",
        "buildCommand": "npm run build:candidate",
        "deployCommand": "npm run deploy:canary",
        "verifyCommand": "npm run verify:canary",
        "approvalPhrase": "Approved to merge and deploy production",
        "promoteWithoutRebuild": false
      },
      {
        "name": "Production",
        "role": "production",
        "url": "https://example.invalid",
        "buildCommand": "",
        "deployCommand": "npm run promote:production",
        "verifyCommand": "npm run verify:production",
        "approvalPhrase": "Approved to merge and deploy production",
        "promoteWithoutRebuild": true
      }
    ]
  },
  "qa": {
    "mode": "circulating",
    "pms": [{ "id": "project-manager", "kind": "human" }],
    "applicationType": "web",
    "runtimePlatforms": [
      {
        "os": "linux",
        "architecture": "x64"
      }
    ],
    "candidateIdentity": [
      "sourceCommit",
      "gitTree"
    ],
    "developers": [
      {
        "id": "developer-a",
        "kind": "agent",
        "github": "developer-a",
        "environments": [
          "local-linux"
        ]
      }
    ],
    "environments": [
      {
        "id": "local-linux",
        "os": "linux",
        "architecture": "x64",
        "prerequisites": [
          "Compatible local container runtime; configure project ports, fixtures and dependencies"
        ],
        "setup": [
          "npm ci"
        ],
        "suite": [
          "npm run check"
        ],
        "teardown": [
          "./scripts/cleanup-qa.sh"
        ]
      }
    ],
    "turns": [
      {
        "id": "local",
        "developer": "developer-a",
        "environment": "local-linux",
        "pm": "project-manager",
        "approvalPhrase": "Local QA approved"
      }
    ]
  }
}
